{
  "organizationID": "ORG-002",
  "orgTitle": "Deutsche Bahn AG",
  "orgShortName": "DB",
  "orgType": "publicLimitedCompany",
  "country": "Germany",
  "description": "National railway company providing passenger and freight transportation services across Germany and Europe",
  "structureType": "divisional",
  "missionStatement": "Connect people and markets through sustainable mobility solutions",
  "visionStatement": "Leading integrated mobility provider in Europe",
  "values": "Customer Focus, Sustainability, Innovation, Reliability",
  "legalStructure": "publicLimitedCompany",
  "geographicScope": "multinational",
  "operationalModel": "hubAndSpokeModel",
  "currency": "eur",
  "cultureType": "customerCentric",
  "size": "338,000 employees, €44.4B annual revenue",
  "complianceFrameworks": [
    "iso9001",
    "iso14001",
    "gdpr"
  ],
  "primaryLanguages": [
    "german",
    "english"
  ]
}
